{
  "schemaVersion": 1,
  "contractName": "AzPrMachineAxis",
  "kind": "azpr-machine-axis",
  "dataIdentity": {
    "verifiedMechanicsPackageId": "azpr-tc-2026-07-18",
    "verifiedMechanicsPackageHash": "04794a7c3de2ddc5bfea9ba2808e33241494c228c7428ba838777486ce305216",
    "mechanicsProfileId": "azpr-three-value-verified-tc-20260718",
    "mechanicsProfileVersion": 1
  },
  "scenario": {
    "id": "m12-b3-e20-2-108003-s1-visual-acceptance",
    "name": "M12-B3-E20-2-108003-S1 米蒂真实机制验收轴",
    "fps": 60,
    "durationFrames": 10100,
    "team": [
      {
        "slotId": "slot-1",
        "characterId": 108003,
        "level": 1,
        "initialSp": 100,
        "loadout": {},
        "cultivation": {}
      },
      {
        "slotId": "slot-2",
        "characterId": 101010,
        "level": 1,
        "initialSp": 0,
        "loadout": {},
        "cultivation": {}
      },
      {
        "slotId": "slot-3",
        "characterId": 103002,
        "level": 1,
        "initialSp": 0,
        "loadout": {},
        "cultivation": {}
      }
    ],
    "enemy": {
      "enemyId": 300032,
      "level": 1,
      "hpMultiplier": 1,
      "defenseMultiplier": 1,
      "toughnessMultiplier": 1,
      "initialToughnessRatio": 1,
      "elementDefenseOverrides": {}
    },
    "initialRuntimeState": {
      "specialResourcesByActor": [],
      "activeEffects": [
        {
          "instanceKey": "protocol:108003:critical-rate-boundary-source:actor-108003",
          "effectId": "protocol:108003:critical-rate-boundary-source",
          "effectName": "米蒂临界率边界源属性",
          "sourceActorId": "actor-108003",
          "targetKind": "actor",
          "targetId": "actor-108003",
          "remainingDurationMs": 20000,
          "stacks": 1,
          "maxStacks": 1,
          "modifiers": [
            {
              "kind": "battle-property",
              "attributeId": 7,
              "bucket": "dynamicExtra",
              "valueRaw": 9500,
              "propertyTags": []
            }
          ],
          "sourceStatus": "verified-battle-effect-generated",
          "sourceIdentity": {
            "packageId": "azpr-tc-2026-07-18",
            "actionBindingIdentity": "protocol:108003:critical-rate-boundary-source",
            "effectIdentity": "protocol:108003:critical-rate-boundary-source"
          },
          "appliedToCalculators": true
        },
        {
          "instanceKey": "protocol:108003:critical-rate-zero-offset:actor-108003",
          "effectId": "protocol:108003:critical-rate-zero-offset",
          "effectName": "米蒂临界率零点偏移",
          "sourceActorId": "actor-108003",
          "targetKind": "actor",
          "targetId": "actor-108003",
          "remainingDurationMs": 10000,
          "stacks": 1,
          "maxStacks": 1,
          "modifiers": [
            {
              "kind": "battle-property",
              "attributeId": 7,
              "bucket": "dynamicExtra",
              "valueRaw": -10000,
              "propertyTags": []
            }
          ],
          "sourceStatus": "verified-battle-effect-generated",
          "sourceIdentity": {
            "packageId": "azpr-tc-2026-07-18",
            "actionBindingIdentity": "protocol:108003:critical-rate-zero-offset",
            "effectIdentity": "protocol:108003:critical-rate-zero-offset"
          },
          "appliedToCalculators": true
        }
      ]
    },
    "critical": {
      "policy": "sampled",
      "seed": "m12-b3-e20-2-108003-s1-critical"
    },
    "projectile": {
      "targetDistance": 0,
      "defaultWillHit": true
    },
    "target": {
      "hpMode": "infinite",
      "toughnessMode": "disabled",
      "breakMode": "disabled",
      "deathTruncation": "disabled"
    },
    "optimizationScenarioPolicy": {
      "policyId": "m12c-zero-distance-passive-boss-v1",
      "policyHash": "967b0667f315db5b",
      "rosterPolicyId": "m12c-wind-thunder-mark-producer-roster-v1",
      "rosterHash": "a690b860f0967e3d"
    }
  },
  "actions": [
    {
      "id": "miti-full-charge-state-on",
      "owner": {
        "kind": "actor",
        "slotId": "slot-1"
      },
      "intent": {
        "kind": "public-action",
        "publicActionId": 10800301,
        "actionKind": "charged-attack",
        "semanticVariant": {
          "selectorIdentity": "miti-full-charge",
          "selectorKind": "charging-release-frame",
          "chargeTier": 3,
          "mode": "release",
          "inputFrame": 67
        },
        "level": 1
      },
      "schedule": {
        "mode": "absolute",
        "frame": 3600
      }
    }
  ],
  "metadata": {
    "phase": "M12-B3-E20-2-108003-S1",
    "probeContract": "canonical-machine-axis-real-settlement",
    "requiredWorkbenchImport": true,
    "evidencePurpose": "m12-c-charged-owner-visual-signoff",
    "sourceFixturePath": "fixtures/character-acceptance/108003-active-surface-closure.json",
    "targetActionId": "miti-full-charge-state-on",
    "contextClosureActionIds": [
      "miti-full-charge-state-on"
    ]
  }
}
