{
  "schemaVersion": 1,
  "contractName": "AzPrMachineAxis",
  "kind": "azpr-machine-axis",
  "dataIdentity": {
    "verifiedMechanicsPackageId": "azpr-tc-2026-07-18",
    "verifiedMechanicsPackageHash": "01400e59a5966428f40df9fd02d957b1de85e0cfcab6aaf2f9dc9b6550917615",
    "mechanicsProfileId": "azpr-three-value-verified-tc-20260718",
    "mechanicsProfileVersion": 1
  },
  "scenario": {
    "id": "m12-b3-103002-reload-window-boundaries",
    "name": "M12-B3 红宝石换弹快进强化右开边界轴",
    "fps": 60,
    "durationFrames": 1800,
    "team": [
      {
        "slotId": "slot-1",
        "characterId": 103002,
        "level": 1,
        "initialSp": 100,
        "loadout": {},
        "cultivation": {}
      },
      {
        "slotId": "slot-2",
        "characterId": 101010,
        "level": 1,
        "initialSp": 0,
        "loadout": {},
        "cultivation": {}
      },
      {
        "slotId": "slot-3",
        "characterId": 101003,
        "level": 1,
        "initialSp": 0,
        "loadout": {},
        "cultivation": {}
      }
    ],
    "enemy": {
      "enemyId": 300032,
      "level": 1,
      "hpMultiplier": 1,
      "defenseMultiplier": 1,
      "toughnessMultiplier": 1,
      "initialToughnessRatio": 1,
      "elementDefenseOverrides": {}
    },
    "initialRuntimeState": {
      "specialResourcesByActor": [
        {
          "actorId": "actor-103002",
          "characterId": 103002,
          "actorName": "红宝石",
          "resourceIdentity": "actor:103002:element:103002047",
          "resourceName": "弹药",
          "currentValue": 0,
          "maxValue": 12,
          "inputStep": 1,
          "scenarioConfigurable": true,
          "baselineStatus": "scenario-configurable-initial-state"
        }
      ]
    },
    "critical": {
      "policy": "sampled",
      "seed": "m12-b3-103002-window-boundaries"
    },
    "projectile": { "targetDistance": 0, "defaultWillHit": true },
    "target": {
      "hpMode": "infinite",
      "toughnessMode": "disabled",
      "breakMode": "disabled",
      "deathTruncation": "disabled"
    },
    "optimizationScenarioPolicy": {
      "policyId": "m12c-zero-distance-passive-boss-v1",
      "policyHash": "967b0667f315db5b",
      "rosterPolicyId": "m12c-wind-thunder-mark-producer-roster-v1",
      "rosterHash": "a690b860f0967e3d"
    }
  },
  "actions": [
    {
      "id": "reload-before-source",
      "owner": { "kind": "actor", "slotId": "slot-1" },
      "intent": {
        "kind": "public-action",
        "publicActionId": 10300201,
        "actionKind": "charged-attack",
        "level": 1
      },
      "schedule": { "mode": "absolute", "frame": 300 }
    },
    {
      "id": "window-outside-before",
      "owner": { "kind": "actor", "slotId": "slot-1" },
      "intent": {
        "kind": "public-action",
        "publicActionId": 10300201,
        "actionKind": "normal-attack",
        "attackInput": {
          "sequenceIndex": 1,
          "groupId": "reload-before"
        },
        "level": 1
      },
      "schedule": { "mode": "absolute", "frame": 0 }
    },
    {
      "id": "reload-start-source",
      "owner": { "kind": "actor", "slotId": "slot-1" },
      "intent": {
        "kind": "public-action",
        "publicActionId": 10300201,
        "actionKind": "charged-attack",
        "level": 1
      },
      "schedule": { "mode": "absolute", "frame": 400 }
    },
    {
      "id": "window-inside-start",
      "owner": { "kind": "actor", "slotId": "slot-1" },
      "intent": {
        "kind": "public-action",
        "publicActionId": 10300201,
        "actionKind": "normal-attack",
        "attackInput": {
          "sequenceIndex": 1,
          "groupId": "reload-start",
          "chainIdentity": "ruby-enhanced-twelve-inputs",
          "contextActionId": "reload-start-source"
        },
        "level": 1
      },
      "schedule": { "mode": "absolute", "frame": 424 }
    },
    {
      "id": "reload-end-source",
      "owner": { "kind": "actor", "slotId": "slot-1" },
      "intent": {
        "kind": "public-action",
        "publicActionId": 10300201,
        "actionKind": "charged-attack",
        "level": 1
      },
      "schedule": { "mode": "absolute", "frame": 800 }
    },
    {
      "id": "window-inside-end",
      "owner": { "kind": "actor", "slotId": "slot-1" },
      "intent": {
        "kind": "public-action",
        "publicActionId": 10300201,
        "actionKind": "normal-attack",
        "attackInput": {
          "sequenceIndex": 1,
          "groupId": "reload-end",
          "chainIdentity": "ruby-enhanced-twelve-inputs",
          "contextActionId": "reload-end-source"
        },
        "level": 1
      },
      "schedule": { "mode": "absolute", "frame": 1063 }
    },
    {
      "id": "reload-after-source",
      "owner": { "kind": "actor", "slotId": "slot-1" },
      "intent": {
        "kind": "public-action",
        "publicActionId": 10300201,
        "actionKind": "charged-attack",
        "level": 1
      },
      "schedule": { "mode": "absolute", "frame": 1200 }
    },
    {
      "id": "window-outside-after",
      "owner": { "kind": "actor", "slotId": "slot-1" },
      "intent": {
        "kind": "public-action",
        "publicActionId": 10300201,
        "actionKind": "normal-attack",
        "attackInput": {
          "sequenceIndex": 1,
          "groupId": "reload-after"
        },
        "level": 1
      },
      "schedule": { "mode": "absolute", "frame": 1464 }
    }
  ],
  "metadata": {
    "phase": "M12-B3-103002-line-b",
    "ownerId": 103002,
    "scenarioPolicy": "m12c-zero-distance-passive-boss-v1",
    "probeContract": "reload-right-open-window-boundary",
    "kiboDnaFactors": []
  }
}
